{
  "brief_id": "BRIEF_20260319_142004_cff6b436",
  "timestamp": "2026-03-19T20:20:04.614935+00:00",
  "status": "healthy",
  "source_review": "REVIEW_20260319_141808_43b4a484",
  "briefs": [
    {
      "script_id": "SCR_0ae0fee3d3ff",
      "title": "TechCrunch\u00a0Startup Battlefield 200 nominations\u00a0are still\u00a0open",
      "format": "standard",
      "duration_target": 150,
      "visual_style": {
        "primary_color": "#6366F1",
        "secondary_color": "#0F0F23",
        "font_family": "Inter Medium",
        "mood": "professional",
        "lighting": "balanced"
      },
      "required_assets": [
        {
          "asset_type": "thumbnail",
          "purpose": "Video thumbnail for platforms",
          "count": 1
        },
        {
          "asset_type": "intro_card",
          "purpose": "Opening title card",
          "count": 1
        },
        {
          "asset_type": "lower_third",
          "purpose": "Name/topic lower thirds",
          "count": 3
        },
        {
          "asset_type": "broll",
          "purpose": "B-roll footage pack",
          "count": 5
        },
        {
          "asset_type": "title_card",
          "purpose": "Section title cards",
          "count": 3
        },
        {
          "asset_type": "end_card",
          "purpose": "Subscribe CTA end card",
          "count": 1
        }
      ],
      "scene_map": [
        {
          "scene_id": "SCENE_01",
          "t_start": 0.0,
          "t_end": 15.0,
          "section": "hook",
          "on_screen_text": "HOOK: Hook",
          "broll_intent": "Attention-grabbing tech visuals, glitch effects",
          "vo_summary": "[HOOK] What TechCrunch AI's announcement really means"
        },
        {
          "scene_id": "SCENE_02",
          "t_start": 15.0,
          "t_end": 37.0,
          "section": "context",
          "on_screen_text": "CONTEXT: Context",
          "broll_intent": "Historical footage, timeline graphics",
          "vo_summary": "[CONTEXT] Background on this development..."
        },
        {
          "scene_id": "SCENE_03",
          "t_start": 37.0,
          "t_end": 89.0,
          "section": "details",
          "on_screen_text": "DETAILS: Details",
          "broll_intent": "Product shots, UI demos, data visualizations",
          "vo_summary": "[DETAILS] Nominate your startup, or one you know, for TechCrunch Startup Battlefield 200 before May "
        },
        {
          "scene_id": "SCENE_04",
          "t_start": 89.0,
          "t_end": 126.0,
          "section": "analysis",
          "on_screen_text": "ANALYSIS: Analysis",
          "broll_intent": "Charts, graphs, expert-style talking head frame",
          "vo_summary": "[ANALYSIS] Here's why this matters: What this means for the industry"
        },
        {
          "scene_id": "SCENE_05",
          "t_start": 126.0,
          "t_end": 141.0,
          "section": "takeaway",
          "on_screen_text": "TAKEAWAY: Takeaway",
          "broll_intent": "Key point graphics, summary card",
          "vo_summary": "[TAKEAWAY] The key point to remember..."
        },
        {
          "scene_id": "SCENE_06",
          "t_start": 141.0,
          "t_end": 148.0,
          "section": "cta",
          "on_screen_text": "CTA: Cta",
          "broll_intent": "Subscribe button animation, social handles",
          "vo_summary": "[CTA] Subscribe for more AI insights. Drop a comment with your thoughts."
        }
      ],
      "compliance": {
        "disallowed_words": [
          "guaranteed",
          "100%",
          "proven"
        ],
        "music_policy": "royalty_free_only",
        "trademark_risks": []
      }
    },
    {
      "script_id": "SCR_a2e355ba7f05",
      "title": "Meta rolls out new AI content enforcement systems while reducing reliance on third-party vendors",
      "format": "standard",
      "duration_target": 150,
      "visual_style": {
        "primary_color": "#6366F1",
        "secondary_color": "#0F0F23",
        "font_family": "Inter Medium",
        "mood": "professional",
        "lighting": "balanced"
      },
      "required_assets": [
        {
          "asset_type": "thumbnail",
          "purpose": "Video thumbnail for platforms",
          "count": 1
        },
        {
          "asset_type": "intro_card",
          "purpose": "Opening title card",
          "count": 1
        },
        {
          "asset_type": "lower_third",
          "purpose": "Name/topic lower thirds",
          "count": 3
        },
        {
          "asset_type": "broll",
          "purpose": "B-roll footage pack",
          "count": 5
        },
        {
          "asset_type": "title_card",
          "purpose": "Section title cards",
          "count": 3
        },
        {
          "asset_type": "end_card",
          "purpose": "Subscribe CTA end card",
          "count": 1
        }
      ],
      "scene_map": [
        {
          "scene_id": "SCENE_01",
          "t_start": 0.0,
          "t_end": 15.0,
          "section": "hook",
          "on_screen_text": "HOOK: Hook",
          "broll_intent": "Attention-grabbing tech visuals, glitch effects",
          "vo_summary": "[HOOK] The AI world is buzzing about Meta rolls out new AI content enforcement systems while reducin"
        },
        {
          "scene_id": "SCENE_02",
          "t_start": 15.0,
          "t_end": 37.0,
          "section": "context",
          "on_screen_text": "CONTEXT: Context",
          "broll_intent": "Historical footage, timeline graphics",
          "vo_summary": "[CONTEXT] Background on this development..."
        },
        {
          "scene_id": "SCENE_03",
          "t_start": 37.0,
          "t_end": 89.0,
          "section": "details",
          "on_screen_text": "DETAILS: Details",
          "broll_intent": "Product shots, UI demos, data visualizations",
          "vo_summary": "[DETAILS] Meta believes these AI systems can detect more violations with greater accuracy, better pr"
        },
        {
          "scene_id": "SCENE_04",
          "t_start": 89.0,
          "t_end": 126.0,
          "section": "analysis",
          "on_screen_text": "ANALYSIS: Analysis",
          "broll_intent": "Charts, graphs, expert-style talking head frame",
          "vo_summary": "[ANALYSIS] Here's why this matters: What this means for the industry"
        },
        {
          "scene_id": "SCENE_05",
          "t_start": 126.0,
          "t_end": 141.0,
          "section": "takeaway",
          "on_screen_text": "TAKEAWAY: Takeaway",
          "broll_intent": "Key point graphics, summary card",
          "vo_summary": "[TAKEAWAY] The key point to remember..."
        },
        {
          "scene_id": "SCENE_06",
          "t_start": 141.0,
          "t_end": 148.0,
          "section": "cta",
          "on_screen_text": "CTA: Cta",
          "broll_intent": "Subscribe button animation, social handles",
          "vo_summary": "[CTA] Subscribe for more AI insights. Drop a comment with your thoughts."
        }
      ],
      "compliance": {
        "disallowed_words": [
          "guaranteed",
          "100%",
          "proven"
        ],
        "music_policy": "royalty_free_only",
        "trademark_risks": [
          "Meta trademark"
        ]
      }
    },
    {
      "script_id": "SCR_8e93f5e2bf9a",
      "title": "DoorDash launches a new \u2018Tasks\u2019 app that pays couriers to submit videos to train AI",
      "format": "standard",
      "duration_target": 150,
      "visual_style": {
        "primary_color": "#6366F1",
        "secondary_color": "#0F0F23",
        "font_family": "Inter Medium",
        "mood": "professional",
        "lighting": "balanced"
      },
      "required_assets": [
        {
          "asset_type": "thumbnail",
          "purpose": "Video thumbnail for platforms",
          "count": 1
        },
        {
          "asset_type": "intro_card",
          "purpose": "Opening title card",
          "count": 1
        },
        {
          "asset_type": "lower_third",
          "purpose": "Name/topic lower thirds",
          "count": 3
        },
        {
          "asset_type": "broll",
          "purpose": "B-roll footage pack",
          "count": 5
        },
        {
          "asset_type": "title_card",
          "purpose": "Section title cards",
          "count": 3
        },
        {
          "asset_type": "end_card",
          "purpose": "Subscribe CTA end card",
          "count": 1
        }
      ],
      "scene_map": [
        {
          "scene_id": "SCENE_01",
          "t_start": 0.0,
          "t_end": 15.0,
          "section": "hook",
          "on_screen_text": "HOOK: Hook",
          "broll_intent": "Attention-grabbing tech visuals, glitch effects",
          "vo_summary": "[HOOK] What TechCrunch AI's announcement really means"
        },
        {
          "scene_id": "SCENE_02",
          "t_start": 15.0,
          "t_end": 37.0,
          "section": "context",
          "on_screen_text": "CONTEXT: Context",
          "broll_intent": "Historical footage, timeline graphics",
          "vo_summary": "[CONTEXT] Background on this development..."
        },
        {
          "scene_id": "SCENE_03",
          "t_start": 37.0,
          "t_end": 89.0,
          "section": "details",
          "on_screen_text": "DETAILS: Details",
          "broll_intent": "Product shots, UI demos, data visualizations",
          "vo_summary": "[DETAILS] Delivery couriers will be able to earn money by completing activities like filming everyda"
        },
        {
          "scene_id": "SCENE_04",
          "t_start": 89.0,
          "t_end": 126.0,
          "section": "analysis",
          "on_screen_text": "ANALYSIS: Analysis",
          "broll_intent": "Charts, graphs, expert-style talking head frame",
          "vo_summary": "[ANALYSIS] Here's why this matters: What this means for the industry"
        },
        {